source_folder,file_name,document_id,source,url,focus,pid,qid,qtype,question,answer,clinical_note,cluster,pca_x,pca_y
1_CancerGov_QA,0000018_1.xml,0000018_1,CancerGov,https://www.cancer.gov/types/retinoblastoma/patient/retinoblastoma-treatment-pdq,Retinoblastoma,4,0000018_1-4,symptoms,What are the symptoms of Retinoblastoma ?,These and other signs and symptoms may be caused by retinoblastoma or by other conditions. Check with a doctor if your child has any of the following:         -  Pupil of the eye appears white instead of red when light shines into it. This may be seen in flash photographs of the child.    - Eyes appear to be looking in different directions (lazy eye).    - Pain or redness in the eye.    -  Infection around the eye.     - Eyeball is larger than normal.     - Colored part of the eye and pupil look cloudy.,"Pt presents with Eyes appear to be looking in different directions (lazy eye), Pain or redness in the eye, Infection around the eye, Eyeball is larger than normal, Colored part of the eye and pupil look cloudy.",1,-0.017498143,0.04749519
1_CancerGov_QA,0000019_1.xml,0000019_1,CancerGov,https://www.cancer.gov/types/ovarian/patient/ovarian-epithelial-treatment-pdq,"Ovarian Epithelial, Fallopian Tube, and Primary Peritoneal Cancer",5,0000019_1-5,symptoms,"What are the symptoms of Ovarian Epithelial, Fallopian Tube, and Primary Peritoneal Cancer ?","Signs and symptoms of ovarian, fallopian tube, or peritoneal cancer include pain or swelling in the abdomen. Ovarian, fallopian tube, or peritoneal cancer may not cause early signs or symptoms. When signs or symptoms do appear, the cancer is often advanced. Signs and symptoms may include the following:         - Pain, swelling, or a feeling of pressure in the abdomen or pelvis.    -  Vaginal bleeding that is heavy or irregular, especially after menopause.    - Vaginal discharge that is clear, white, or colored with blood.    - A lump in the pelvic area.    -  Gastrointestinal problems, such as gas, bloating, or constipation.        These signs and symptoms also may be caused by other conditions and not by ovarian, fallopian tube, or peritoneal cancer. If the signs or symptoms get worse or do not go away on their own, check with your doctor so that any problem can be diagnosed and treated as early as possible.","Pt presents with Pain, swelling, or a feeling of pressure in the abdomen or pelvis, Vaginal bleeding that is heavy or irregular, especially after menopause, Vaginal discharge that is clear, white, or colored with blood, A lump in the pelvic area, Gastrointestinal problems, such as gas, bloating, or constipation.",2,-0.29018945,-0.16247578
1_CancerGov_QA,0000019_2.xml,0000019_2,CancerGov,https://www.cancer.gov/types/ovarian/patient/ovarian-germ-cell-treatment-pdq,Ovarian Germ Cell Tumors,2,0000019_2-2,symptoms,What are the symptoms of Ovarian Germ Cell Tumors ?,"Signs of ovarian germ cell tumor are swelling of the abdomen or vaginal bleeding after menopause. Ovarian germ cell tumors can be hard to diagnose (find) early. Often there are no symptoms in the early stages, but tumors may be found during regular gynecologic exams (checkups). Check with your doctor if you have either of the following:          - Swollen abdomen without weight gain in other parts of the body.     - Bleeding from the vagina after menopause (when you are no longer having menstrual periods).",Pt presents with Swollen abdomen without weight gain in other parts of the body.,2,-0.14687932,-0.12065684
1_CancerGov_QA,0000019_3.xml,0000019_3,CancerGov,https://www.cancer.gov/types/ovarian/patient/ovarian-low-malignant-treatment-pdq,Ovarian Low Malignant Potential Tumors,2,0000019_3-2,symptoms,What are the symptoms of Ovarian Low Malignant Potential Tumors ?,"Signs and symptoms of ovarian low malignant potential tumor include pain or swelling in the abdomen.Ovarian low malignant potential tumor may not cause early signs or symptoms. If you do have signs or symptoms, they may include the following:         - Pain or swelling in the abdomen.    - Pain in the pelvis.    -  Gastrointestinal problems, such as gas, bloating, or constipation.        These signs and symptoms may be caused by other conditions. If they get worse or do not go away on their own, check with your doctor.","Pt presents with Pain or swelling in the abdomen, Pain in the pelvis, Gastrointestinal problems, such as gas, bloating, or constipation.",2,-0.23964937,-0.09106145
1_CancerGov_QA,0000020_1.xml,0000020_1,CancerGov,https://www.cancer.gov/types/gallbladder/patient/gallbladder-treatment-pdq,Gallbladder Cancer,3,0000020_1-3,symptoms,What are the symptoms of Gallbladder Cancer ?,"Signs and symptoms of gallbladder cancer include jaundice, fever, and pain. These and other signs and symptoms may be caused by gallbladder cancer or by other conditions. Check with your doctor if you have any of the following:         -  Jaundice (yellowing of the skin and whites of the eyes).    - Pain above the stomach.    -  Fever.    -  Nausea and vomiting.    -  Bloating.    - Lumps in the abdomen.","Pt presents with Jaundice (yellowing of the skin and whites of the eyes), Pain above the stomach, Fever, Nausea and vomiting, Bloating, Lumps in the abdomen.",2,-0.2946544,0.121496774
1_CancerGov_QA,0000022_1.xml,0000022_1,CancerGov,https://www.cancer.gov/types/gestational-trophoblastic/patient/gtd-treatment-pdq,Gestational Trophoblastic Disease,3,0000022_1-3,symptoms,What are the symptoms of Gestational Trophoblastic Disease ?,"Signs of GTD include abnormal vaginal bleeding and a uterus that is larger than normal. These and other signs and symptoms may be caused by gestational trophoblastic disease or by other conditions. Check with your doctor if you have any of the following:         -  Vaginal bleeding not related to menstruation.    -  A uterus that is larger than expected during pregnancy.    - Pain or pressure in the pelvis.    - Severe nausea and vomiting during pregnancy.    - High blood pressure with headache and swelling of feet and hands early in the pregnancy.    - Vaginal bleeding that continues for longer than normal after delivery.    -  Fatigue, shortness of breath, dizziness, and a fast or irregular heartbeat caused by anemia.        GTD sometimes causes an overactive thyroid. Signs and symptoms of an overactive thyroid include the following:         - Fast or irregular heartbeat.    - Shakiness.    - Sweating.    - Frequent bowel movements.    - Trouble sleeping.    - Feeling anxious or irritable.    - Weight loss.","Pt presents with Vaginal bleeding not related to menstruation, A uterus that is larger than expected during pregnancy, Pain or pressure in the pelvis, Severe nausea and vomiting during pregnancy, Vaginal bleeding that continues for longer than normal after delivery, Fast or irregular heartbeat.",2,-0.2227275,-0.1190981
1_CancerGov_QA,0000023_1.xml,0000023_1,CancerGov,https://www.cancer.gov/types/langerhans/patient/langerhans-treatment-pdq,Langerhans Cell Histiocytosis,3,0000023_1-3,symptoms,What are the symptoms of Langerhans Cell Histiocytosis ?,"These and other signs and symptoms may be caused by LCH or by other conditions. Check with your doctor if you or your child have any of the following:     Skin and nails    LCH in infants may affect the skin only. In some cases, skin-only LCH may get worse over weeks or months and become a form called high-risk multisystem LCH.     In infants, signs or symptoms of LCH that affects the skin may include:            -  Flaking of the scalp that may look like cradle cap.     - Raised, brown or purple skin rash anywhere on the body.            In children and adults, signs or symptoms of LCH that affects the skin and nails may include:            -  Flaking of the scalp that may look like dandruff.     -  Raised, red or brown, crusted rash in the groin area, abdomen, back, or chest, that may be itchy.     - Bumps or ulcers on the scalp.     - Ulcers behind the ears, under the breasts, or in the groin area.     - Fingernails that fall off or have discolored grooves that run the length of the nail.              Mouth    Signs or symptoms of LCH that affects the mouth may include:            - Swollen gums.     - Sores on the roof of the mouth, inside the cheeks, or on the tongue or lips.     - Teeth that become uneven.     - Tooth loss.              Bone    Signs or symptoms of LCH that affects the bone may include:            - Swelling or a lump over a bone, such as the skull, ribs, spine, thigh bone, upper arm bone, elbow, eye socket, or bones around the ear.     - Pain where there is swelling or a lump over a bone.           Children with LCH lesions in bones around the ears or eyes have a high risk for diabetes insipidus and other central nervous system disease.       Lymph nodes and thymus    Signs or symptoms of LCH that affects the lymph nodes or thymus may include:            - Swollen lymph nodes.     - Trouble breathing.     -  Superior vena cava syndrome. This can cause coughing, trouble breathing, and swelling of the face, neck, and upper arms.              Endocrine system     Signs or symptoms of LCH that affects the pituitary gland may include:            - Diabetes insipidus. This can cause a strong thirst and frequent urination.     - Slow growth.     - Early or late puberty.     - Being very overweight.           Signs or symptoms of LCH that affects the thyroid may include:            - Swollen thyroid gland.     -  Hypothyroidism. This can cause tiredness, lack of energy, being sensitive to cold, constipation, dry skin, thinning hair, memory problems, trouble concentrating, and depression. In infants, this can also cause a loss of appetite and choking on food. In children and adolescents, this can also cause behavior problems, weight gain, slow growth, and late puberty.     - Trouble breathing.              Central nervous system (CNS)    Signs or symptoms of LCH that affects the CNS (brain and spinal cord) may include:            - Loss of balance, uncoordinated body movements, and trouble walking.     - Trouble speaking.     - Trouble seeing.     - Headaches.     - Changes in behavior or personality.     - Memory problems.           These signs and symptoms may be caused by lesions in the CNS or by CNS neurodegenerative syndrome.       Liver and spleen    Signs or symptoms of LCH that affects the liver or spleen may include:            - Swelling in the abdomen caused by a buildup of extra fluid.     - Trouble breathing.     - Yellowing of the skin and whites of the eyes.     - Itching.     - Easy bruising or bleeding.     - Feeling very tired.              Lung    Signs or symptoms of LCH that affects the lung may include:            - Collapsed lung. This condition can cause chest pain or tightness, trouble breathing, feeling tired, and a bluish color to the skin.     - Trouble breathing, especially in adults who smoke.     - Dry cough.     - Chest pain.              Bone marrow    Signs or symptoms of LCH that affects the bone marrow may include:            - Easy bruising or bleeding.     -  Fever.     - Frequent infections.","Pt presents with Skin and nails, Flaking of the scalp that may look like cradle cap, Raised, brown or purple skin rash anywhere on the body, Flaking of the scalp that may look like dandruff, Bumps or ulcers on the scalp, Ulcers behind the ears, under the breasts, or in the groin area.",1,-0.112016246,-0.12840869
1_CancerGov_QA,0000024_1.xml,0000024_1,CancerGov,https://www.cancer.gov/types/head-and-neck/patient/hypopharyngeal-treatment-pdq,Hypopharyngeal Cancer,3,0000024_1-3,symptoms,What are the symptoms of Hypopharyngeal Cancer ?,Signs and symptoms of hypopharyngeal cancer include a sore throat and ear pain. These and other signs and symptoms may be caused by hypopharyngeal cancer or by other conditions. Check with your doctor if you have any of the following:         - A sore throat that does not go away.    - Ear pain.    - A lump in the neck.    - Painful or difficult swallowing.     - A change in voice.,"Pt presents with A sore throat that does not go away, Ear pain, A lump in the neck, Painful or difficult swallowing, A change in voice.",1,-0.23465261,0.03644865
1_CancerGov_QA,0000024_2.xml,0000024_2,CancerGov,https://www.cancer.gov/types/head-and-neck/patient/laryngeal-treatment-pdq,Laryngeal Cancer,3,0000024_2-3,symptoms,What are the symptoms of Laryngeal Cancer ?,Signs and symptoms of laryngeal cancer include a sore throat and ear pain. These and other signs and symptoms may be caused by laryngeal cancer or by other conditions. Check with your doctor if you have any of the following:         - A sore throat or cough that does not go away.    - Trouble or pain when swallowing.    - Ear pain.    - A lump in the neck or throat.    - A change or hoarseness in the voice.,"Pt presents with A sore throat or cough that does not go away, Trouble or pain when swallowing, Ear pain, A lump in the neck or throat, A change or hoarseness in the voice.",1,-0.27675888,0.04381892
1_CancerGov_QA,0000024_3.xml,0000024_3,CancerGov,https://www.cancer.gov/types/head-and-neck/patient/lip-mouth-treatment-pdq,Lip and Oral Cavity Cancer,3,0000024_3-3,symptoms,What are the symptoms of Lip and Oral Cavity Cancer ?,"Signs of lip and oral cavity cancer include a sore or lump on the lips or in the mouth. These and other signs and symptoms may be caused by lip and oral cavity cancer or by other conditions. Check with your doctor if you have any of the following:          - A sore on the lip or in the mouth that does not heal.    - A lump or thickening on the lips or gums or in the mouth.    - A white or red patch on the gums, tongue, or lining of the mouth.    - Bleeding, pain, or numbness in the lip or mouth.    - Change in voice.    - Loose teeth or dentures that no longer fit well.    - Trouble chewing or swallowing or moving the tongue or jaw.    - Swelling of jaw.    - Sore throat or feeling that something is caught in the throat.        Lip and oral cavity cancer may not have any symptoms and is sometimes found during a regular dental exam.","Pt presents with Bleeding, pain, or numbness in the lip or mouth, Change in voice, Loose teeth or dentures that no longer fit well, Trouble chewing or swallowing or moving the tongue or jaw, Swelling of jaw, Sore throat or feeling that something is caught in the throat.",1,-0.20813277,0.028436081
1_CancerGov_QA,0000024_5.xml,0000024_5,CancerGov,https://www.cancer.gov/types/head-and-neck/patient/nasopharyngeal-treatment-pdq,Nasopharyngeal Cancer,3,0000024_5-3,symptoms,What are the symptoms of Nasopharyngeal Cancer ?,"Signs of nasopharyngeal cancer include trouble breathing, speaking, or hearing. These and other signs and symptoms may be caused by nasopharyngeal cancer or by other conditions. Check with your doctor if you have any of the following:         - A lump in the nose or neck.    - A sore throat.    - Trouble breathing or speaking.    - Nosebleeds.    - Trouble hearing.    - Pain or ringing in the ear.    - Headaches.","Pt presents with A lump in the nose or neck, A sore throat, Trouble breathing or speaking, Nosebleeds, Trouble hearing, Pain or ringing in the ear.",1,-0.23779333,0.07752965
1_CancerGov_QA,0000024_6.xml,0000024_6,CancerGov,https://www.cancer.gov/types/head-and-neck/patient/oropharyngeal-treatment-pdq,Oropharyngeal Cancer,3,0000024_6-3,symptoms,What are the symptoms of Oropharyngeal Cancer ?,"Signs and symptoms of oropharyngeal cancer include a lump in the neck and a sore throat. These and other signs and symptoms may be caused by oropharyngeal cancer or by other conditions. Check with your doctor if you have any of the following:         - A sore throat that does not go away.    - Trouble swallowing.    - Trouble opening the mouth fully.    - Trouble moving the tongue.    - Weight loss for no known reason.    - Ear pain.    - A lump in the back of the mouth, throat, or neck.    - A white patch on the tongue or lining of the mouth that does not go away.    - Coughing up blood.        Sometimes oropharyngeal cancer does not cause early signs or symptoms.","Pt presents with A sore throat that does not go away, Trouble swallowing, Trouble opening the mouth fully, Trouble moving the tongue, Weight loss for no known reason, Ear pain.",1,-0.18500352,0.08011632
1_CancerGov_QA,0000024_7.xml,0000024_7,CancerGov,https://www.cancer.gov/types/head-and-neck/patient/paranasal-sinus-treatment-pdq,Paranasal Sinus and Nasal Cavity Cancer,3,0000024_7-3,symptoms,What are the symptoms of Paranasal Sinus and Nasal Cavity Cancer ?,"Signs of paranasal sinus and nasal cavity cancer include sinus problems and nosebleeds. These and other signs and symptoms may be caused by paranasal sinus and nasal cavity cancer or by other conditions. There may be no signs or symptoms in the early stages. Signs and symptoms may appear as the tumor grows. Check with your doctor if you have any of the following:         - Blocked sinuses that do not clear, or sinus pressure.    - Headaches or pain in the sinus areas.    - A runny nose.    - Nosebleeds.    - A lump or sore inside the nose that does not heal.    - A lump on the face or roof of the mouth.    - Numbness or tingling in the face.    - Swelling or other trouble with the eyes, such as double vision or the eyes pointing in different directions.    - Pain in the upper teeth, loose teeth, or dentures that no longer fit well.    - Pain or pressure in the ear.","Pt presents with Blocked sinuses that do not clear, or sinus pressure, Headaches or pain in the sinus areas, A runny nose, Nosebleeds, A lump or sore inside the nose that does not heal, A lump on the face or roof of the mouth.",1,-0.16842824,0.11089812
1_CancerGov_QA,0000024_8.xml,0000024_8,CancerGov,https://www.cancer.gov/types/head-and-neck/patient/salivary-gland-treatment-pdq,Salivary Gland Cancer,3,0000024_8-3,symptoms,What are the symptoms of Salivary Gland Cancer ?,"Signs of salivary gland cancer include a lump or trouble swallowing. Salivary gland cancer may not cause any symptoms. It may be found during a regular dental check-up or physical exam. Signs and symptoms may be caused by salivary gland cancer or by other conditions. Check with your doctor if you have any of the following:         - A lump (usually painless) in the area of the ear, cheek, jaw, lip, or inside the mouth.    -  Fluid draining from the ear.    - Trouble swallowing or opening the mouth widely.    - Numbness or weakness in the face.    - Pain in the face that does not go away.","Pt presents with Fluid draining from the ear, Trouble swallowing or opening the mouth widely, Numbness or weakness in the face, Pain in the face that does not go away.",1,-0.0987424,0.08617245
1_CancerGov_QA,0000025_1.xml,0000025_1,CancerGov,https://www.cancer.gov/types/pancreatic/patient/pancreatic-treatment-pdq,Pancreatic Cancer,3,0000025_1-3,symptoms,What are the symptoms of Pancreatic Cancer ?,"Signs and symptoms of pancreatic cancer include jaundice, pain, and weight loss. 
	                    Pancreatic cancer may not cause early signs or symptoms. Signs and symptoms may be caused by pancreatic cancer or by other conditions. Check with your doctor if you have any of the following:         -  Jaundice (yellowing of the skin and whites of the eyes).    - Light-colored stools.    - Dark urine.    - Pain in the upper or middle abdomen and back.     - Weight loss for no known reason.     - Loss of appetite.    - Feeling very tired.
	        	
		        
		                Pancreatic cancer is difficult to detect (find) and diagnose early.
		                Pancreatic cancer is difficult to detect and diagnose for the following reasons:         - There arent any noticeable signs or symptoms in the early stages of pancreatic cancer.    - The signs and symptoms of pancreatic cancer, when present, are like the signs and symptoms of many other illnesses.    - The pancreas is hidden behind other organs such as the stomach, small intestine, liver, gallbladder, spleen, and bile ducts.","Pt presents with Jaundice (yellowing of the skin and whites of the eyes), Light-colored stools, Dark urine, Pain in the upper or middle abdomen and back, Weight loss for no known reason, Loss of appetite.",2,-0.23959643,0.114094734
1_CancerGov_QA,0000026_2.xml,0000026_2,CancerGov,https://www.cancer.gov/types/kidney/patient/transitional-cell-treatment-pdq,Transitional Cell Cancer of the Renal Pelvis and Ureter,3,0000026_2-3,symptoms,What are the symptoms of Transitional Cell Cancer of the Renal Pelvis and Ureter ?,Signs and symptoms of transitional cell cancer of the renal pelvis and ureter include blood in the urine and back pain. These and other signs and symptoms may be caused by transitional cell cancer of the renal pelvis and ureter or by other conditions. There may be no signs or symptoms in the early stages. Signs and symptoms may appear as the tumor grows. Check with your doctor if you have any of the following:         - Blood in the urine.    - A pain in the back that doesn't go away.    - Extreme tiredness.    -  Weight loss with no known reason.     - Painful or frequent urination.,"Pt presents with Blood in the urine, A pain in the back that doesn't go away, Extreme tiredness, Weight loss with no known reason, Painful or frequent urination.",2,-0.25185034,-0.03511587
1_CancerGov_QA,0000026_3.xml,0000026_3,CancerGov,https://www.cancer.gov/types/kidney/patient/wilms-treatment-pdq,Wilms Tumor and Other Childhood Kidney Tumors,3,0000026_3-3,symptoms,What are the symptoms of Wilms Tumor and Other Childhood Kidney Tumors ?,"Signs of Wilms tumor and other childhood kidney tumors include a lump in the abdomen and blood in the urine. Sometimes childhood kidney tumors do not cause signs and symptoms and the parent finds a mass in the abdomen by chance or the mass is found during a well-child health check up. These and other signs and symptoms may be caused by kidney tumors or by other conditions. Check with your child's doctor if your child has any of the following:         - A lump, swelling, or pain in the abdomen.    - Blood in the urine.     -  High blood pressure (headache, feeling very tired, chest pain, or trouble seeing or breathing).    -  Hypercalcemia (loss of appetite, nausea and vomiting, weakness, or feeling very tired).    -  Fever for no known reason.    - Loss of appetite.    - Weight loss for no known reason.        Wilms tumor that has spread to the lungs or liver may cause the following signs and symptoms:         - Cough.    - Blood in the sputum.    - Trouble breathing.    - Pain in the abdomen.","Pt presents with A lump, swelling, or pain in the abdomen, Blood in the urine, Hypercalcemia (loss of appetite, nausea and vomiting, weakness, or feeling very tired), Fever for no known reason, Loss of appetite, Weight loss for no known reason.",2,-0.38600773,-0.05579322
1_CancerGov_QA,0000027_1.xml,0000027_1,CancerGov,https://www.cancer.gov/types/breast/patient/breast-treatment-pdq,Breast Cancer,5,0000027_1-5,symptoms,What are the symptoms of Breast Cancer ?,"Signs of breast cancer include a lump or change in the breast. These and other signs may be caused by breast cancer or by other conditions. Check with your doctor if you have any of the following:         - A lump or thickening in or near the breast or in the underarm area.    - A change in the size or shape of the breast.    - A dimple or puckering in the skin of the breast.    - A nipple turned inward into the breast.    - Fluid, other than breast milk, from the nipple, especially if it's bloody.    - Scaly, red, or swollen skin on the breast, nipple, or areola (the dark area of skin around the nipple).    - Dimples in the breast that look like the skin of an orange, called peau dorange.","Pt presents with A change in the size or shape of the breast, A dimple or puckering in the skin of the breast, A nipple turned inward into the breast, Fluid, other than breast milk, from the nipple, especially if it's bloody.",3,-0.011484347,-0.42334032
1_CancerGov_QA,0000027_3.xml,0000027_3,CancerGov,https://www.cancer.gov/types/breast/patient/pregnancy-breast-treatment-pdq,Breast Cancer,3,0000027_3-3,symptoms,What are the symptoms of Breast Cancer ?,"Signs of breast cancer include a lump or change in the breast.
                    These and other signs may be caused by breast cancer or by other conditions. Check with your doctor if you have any of the following:         - A lump or thickening in or near the breast or in the underarm area.    -  A change in the size or shape of the breast.    -  A dimple or puckering in the skin of the breast.    -  A nipple turned inward into the breast.    - Fluid, other than breast milk, from the nipple, especially if it's bloody.    - Scaly, red, or swollen skin on the breast, nipple, or areola (the dark area of skin around the nipple).    - Dimples in the breast that look like the skin of an orange, called peau dorange.
                
                
                    It may be difficult to detect (find) breast cancer early in pregnant or nursing women.
                    The breasts usually get larger, tender, or lumpy in women who are pregnant, nursing, or have just given birth. This occurs because of normal hormone changes that take place during pregnancy. These changes can make small lumps difficult to detect. The breasts may also become denser. It is more difficult to detect breast cancer in women with dense breasts using mammography. Because these breast changes can delay diagnosis, breast cancer is often found at a later stage in these women.","Pt presents with A change in the size or shape of the breast, A dimple or puckering in the skin of the breast, A nipple turned inward into the breast, Fluid, other than breast milk, from the nipple, especially if it's bloody.",3,-0.011484346,-0.42334026
