source_folder,file_name,document_id,source,url,focus,pid,qid,qtype,question,answer,clinical_note,cluster,pca_x,pca_y
1_CancerGov_QA,0000001_1.xml,0000001_1,CancerGov,https://www.cancer.gov/types/leukemia/patient/adult-all-treatment-pdq,Adult Acute Lymphoblastic Leukemia,2,0000001_1-2,symptoms,What are the symptoms of Adult Acute Lymphoblastic Leukemia ?,"Signs and symptoms of adult ALL include fever, feeling tired, and easy bruising or bleeding. The early signs and symptoms of ALL may be like the flu or other common diseases. Check with your doctor if you have any of the following:         - Weakness or feeling tired.    -  Fever or night sweats.    - Easy bruising or bleeding.    -  Petechiae (flat, pinpoint spots under the skin, caused by bleeding).    - Shortness of breath.    - Weight loss or loss of appetite.    - Pain in the bones or stomach.    - Pain or feeling of fullness below the ribs.    - Painless lumps in the neck, underarm, stomach, or groin.    - Having many infections.        These and other signs and symptoms may be caused by adult acute lymphoblastic leukemia or by other conditions.","Pt presents with Weakness or feeling tired, Fever or night sweats, Easy bruising or bleeding, Petechiae (flat, pinpoint spots under the skin, caused by bleeding), Shortness of breath, Weight loss or loss of appetite.",2,-0.3163894,0.00096138444
1_CancerGov_QA,0000001_2.xml,0000001_2,CancerGov,https://www.cancer.gov/types/leukemia/patient/adult-aml-treatment-pdq,Adult Acute Myeloid Leukemia,3,0000001_2-3,symptoms,What are the symptoms of Adult Acute Myeloid Leukemia ?,"Signs and symptoms of adult AML include fever, feeling tired, and easy bruising or bleeding. The early signs and symptoms of AML may be like those caused by the flu or other common diseases. Check with your doctor if you have any of the following:         -  Fever.    - Shortness of breath.    - Easy bruising or bleeding.    -  Petechiae (flat, pinpoint spots under the skin caused by bleeding).    - Weakness or feeling tired.    - Weight loss or loss of appetite.","Pt presents with Fever, Shortness of breath, Easy bruising or bleeding, Petechiae (flat, pinpoint spots under the skin caused by bleeding), Weakness or feeling tired, Weight loss or loss of appetite.",2,-0.3057153,-0.035722826
1_CancerGov_QA,0000001_3.xml,0000001_3,CancerGov,https://www.cancer.gov/types/leukemia/patient/cll-treatment-pdq,Chronic Lymphocytic Leukemia,3,0000001_3-3,symptoms,What are the symptoms of Chronic Lymphocytic Leukemia ?,"Signs and symptoms of chronic lymphocytic leukemia include swollen lymph nodes and tiredness. Usually CLL does not cause any signs or symptoms and is found during a routine blood test. Signs and symptoms may be caused by CLL or by other conditions. Check with your doctor if you have any of the following:         - Painless swelling of the lymph nodes in the neck, underarm, stomach, or groin.    - Feeling very tired.    - Pain or fullness below the ribs.    -  Fever and infection.    - Weight loss for no known reason.","Pt presents with Feeling very tired, Pain or fullness below the ribs, Fever and infection, Weight loss for no known reason.",2,-0.3784314,-0.039489396
1_CancerGov_QA,0000001_4.xml,0000001_4,CancerGov,https://www.cancer.gov/types/leukemia/patient/cml-treatment-pdq,Chronic Myelogenous Leukemia,2,0000001_4-2,symptoms,What are the symptoms of Chronic Myelogenous Leukemia ?,"Signs and symptoms of chronic myelogenous leukemia include fever, night sweats, and tiredness. These and other signs and symptoms may be caused by CML or by other conditions. Check with your doctor if you have any of the following:         - Feeling very tired.    - Weight loss for no known reason.    - Night sweats.    -  Fever.    - Pain or a feeling of fullness below the ribs on the left side.        Sometimes CML does not cause any symptoms at all.","Pt presents with Feeling very tired, Weight loss for no known reason, Night sweats, Fever.",2,-0.31641454,0.11883906
1_CancerGov_QA,0000001_5.xml,0000001_5,CancerGov,https://www.cancer.gov/types/leukemia/patient/hairy-cell-treatment-pdq,Hairy Cell Leukemia,3,0000001_5-3,symptoms,What are the symptoms of Hairy Cell Leukemia ?,"Signs and symptoms of hairy cell leukemia include infections, tiredness, and pain below the ribs. These and other signs and symptoms may be caused by hairy cell leukemia or by other conditions. Check with your doctor if you have any of the following:          - Weakness or feeling tired.    -  Fever or frequent infections.    - Easy bruising or bleeding.    - Shortness of breath.    - Weight loss for no known reason.    - Pain or a feeling of fullness below the ribs.    - Painless lumps in the neck, underarm, stomach, or groin.","Pt presents with Weakness or feeling tired, Fever or frequent infections, Easy bruising or bleeding, Shortness of breath, Weight loss for no known reason, Pain or a feeling of fullness below the ribs.",2,-0.3983325,-0.11671869
1_CancerGov_QA,0000001_6.xml,0000001_6,CancerGov,https://www.cancer.gov/types/leukemia/patient/child-all-treatment-pdq,Childhood Acute Lymphoblastic Leukemia,2,0000001_6-2,symptoms,What are the symptoms of Childhood Acute Lymphoblastic Leukemia ?,"Signs of childhood ALL include fever and bruising. These and other signs and symptoms may be caused by childhood ALL or by other conditions. Check with your child's doctor if your child has any of the following:         -  Fever.    - Easy bruising or bleeding.    -  Petechiae (flat, pinpoint, dark-red spots under the skin caused by bleeding).    - Bone or joint pain.    - Painless lumps in the neck, underarm, stomach, or groin.    - Pain or feeling of fullness below the ribs.    - Weakness, feeling tired, or looking pale.    - Loss of appetite.","Pt presents with Fever, Easy bruising or bleeding, Petechiae (flat, pinpoint, dark-red spots under the skin caused by bleeding), Bone or joint pain, Painless lumps in the neck, underarm, stomach, or groin, Pain or feeling of fullness below the ribs.",2,-0.34980255,-0.19029552
1_CancerGov_QA,0000001_7.xml,0000001_7,CancerGov,https://www.cancer.gov/types/leukemia/patient/child-aml-treatment-pdq,Childhood Acute Myeloid Leukemia and Other Myeloid Malignancies,3,0000001_7-3,symptoms,What are the symptoms of Childhood Acute Myeloid Leukemia and Other Myeloid Malignancies ?,"Signs and symptoms of childhood AML, childhood CML, JMML, or MDS include fever, feeling tired, and easy bleeding or bruising. These and other signs and symptoms may be caused by childhood AML, childhood CML, JMML, or MDS or by other conditions. Check with a doctor if your child has any of the following:         -  Fever with or without an infection.    - Night sweats.    - Shortness of breath.    - Weakness or feeling tired.    - Easy bruising or bleeding.    -  Petechiae (flat, pinpoint spots under the skin caused by bleeding).    - Pain in the bones or joints.    - Pain or feeling of fullness below the ribs.    - Painless lumps in the neck, underarm, stomach, groin, or other parts of the body. In childhood AML, these lumps, called leukemia cutis, may be blue or purple.    - Painless lumps that are sometimes around the eyes. These lumps, called chloromas, are sometimes seen in childhood AML and may be blue-green.    - An eczema -like skin rash.        The signs and symptoms of TMD may include the following:         - Swelling all over the body.    - Shortness of breath.    - Trouble breathing.    - Weakness or feeling tired.    - Pain below the ribs.","Pt presents with Fever with or without an infection, Night sweats, Shortness of breath, Weakness or feeling tired, Easy bruising or bleeding, Petechiae (flat, pinpoint spots under the skin caused by bleeding).",2,-0.3460139,-0.03828451
1_CancerGov_QA,0000003_1.xml,0000003_1,CancerGov,https://www.cancer.gov/types/soft-tissue-sarcoma/patient/adult-soft-tissue-treatment-pdq,Adult Soft Tissue Sarcoma,3,0000003_1-3,symptoms,What are the symptoms of Adult Soft Tissue Sarcoma ?,"A sign of adult soft tissue sarcoma is a lump or swelling in soft tissue of the body. A sarcoma may appear as a painless lump under the skin, often on an arm or a leg. Sarcomas that begin in the abdomen may not cause signs or symptoms until they get very big. As the sarcoma grows bigger and presses on nearby organs, nerves, muscles, or blood vessels, signs and symptoms may include:          - Pain.    - Trouble breathing.        Other conditions may cause the same signs and symptoms. Check with your doctor if you have any of these problems.","Pt presents with Pain, Trouble breathing.",1,-0.20675723,0.100786604
1_CancerGov_QA,0000003_2.xml,0000003_2,CancerGov,https://www.cancer.gov/types/soft-tissue-sarcoma/patient/gist-treatment-pdq,Gastrointestinal Stromal Tumors,3,0000003_2-3,symptoms,What are the symptoms of Gastrointestinal Stromal Tumors ?,"Signs of gastrointestinal stromal tumors include blood in the stool or vomit. These and other signs and symptoms may be caused by a GIST or by other conditions. Check with your doctor if you have any of the following:         -  Blood (either bright red or very dark) in the stool or vomit.    - Pain in the abdomen, which may be severe.    - Feeling very tired.    - Trouble or pain when swallowing.    - Feeling full after only a little food is eaten.","Pt presents with Blood (either bright red or very dark) in the stool or vomit, Pain in the abdomen, which may be severe, Feeling very tired, Trouble or pain when swallowing, Feeling full after only a little food is eaten.",2,-0.37148803,-0.07933197
1_CancerGov_QA,0000003_4.xml,0000003_4,CancerGov,https://www.cancer.gov/types/soft-tissue-sarcoma/patient/rhabdomyosarcoma-treatment-pdq,Childhood Rhabdomyosarcoma,2,0000003_4-2,symptoms,What are the symptoms of Childhood Rhabdomyosarcoma ?,"A sign of childhood rhabdomyosarcoma is a lump or swelling that keeps getting bigger. Signs and symptoms may be caused by childhood rhabdomyosarcoma or by other conditions. The signs and symptoms that occur depend on where the cancer forms. Check with your child's doctor if your child has any of the following:         - A lump or swelling that keeps getting bigger or does not go away. It may be painful.     - Bulging of the eye.    - Headache.    - Trouble urinating or having bowel movements.    -  Blood in the urine.    - Bleeding in the nose, throat, vagina, or rectum.","Pt presents with Bulging of the eye, Headache, Trouble urinating or having bowel movements, Blood in the urine, Bleeding in the nose, throat, vagina, or rectum.",1,-0.19623755,0.10014404
1_CancerGov_QA,0000004_1.xml,0000004_1,CancerGov,https://www.cancer.gov/types/lymphoma/patient/adult-hodgkin-treatment-pdq,Adult Hodgkin Lymphoma,3,0000004_1-3,symptoms,What are the symptoms of Adult Hodgkin Lymphoma ?,"Signs of adult Hodgkin lymphoma include swollen lymph nodes, fever, night sweats, and weight loss. These and other signs and symptoms may be caused by adult Hodgkin lymphoma or by other conditions. Check with your doctor if any of the following do not go away:         - Painless, swollen lymph nodes in the neck, underarm, or groin.    -  Fever for no known reason.    - Drenching night sweats.    - Weight loss for no known reason.    - Itchy skin.    - Feeling very tired.","Pt presents with Painless, swollen lymph nodes in the neck, underarm, or groin, Fever for no known reason, Drenching night sweats, Weight loss for no known reason, Itchy skin, Feeling very tired.",2,-0.31531966,-0.14995234
1_CancerGov_QA,0000004_2.xml,0000004_2,CancerGov,https://www.cancer.gov/types/lymphoma/patient/adult-nhl-treatment-pdq,Adult Non-Hodgkin Lymphoma,4,0000004_2-4,symptoms,What are the symptoms of Adult Non-Hodgkin Lymphoma ?,"Signs and symptoms of adult non-Hodgkin lymphoma include swelling in the lymph nodes, fever, night sweats, weight loss, and fatigue. These signs and symptoms may be caused by adult non-Hodgkin lymphoma or by other conditions. Check with your doctor if you have any of the following:         - Swelling in the lymph nodes in the neck, underarm, groin, or stomach.    - Fever for no known reason.    - Recurring night sweats.    - Feeling very tired.    - Weight loss for no known reason.    - Skin rash or itchy skin.    - Pain in the chest, abdomen, or bones for no known reason.        When fever, night sweats, and weight loss occur together, this group of symptoms is called B symptoms.    Other signs and symptoms of adult non-Hodgkin lymphoma may occur and depend on the following:          - Where the cancer forms in the body.    - The size of the tumor.    - How fast the tumor grows.","Pt presents with Swelling in the lymph nodes in the neck, underarm, groin, or stomach, Fever for no known reason, Recurring night sweats, Feeling very tired, Weight loss for no known reason, Skin rash or itchy skin.",2,-0.31414205,-0.1515826
1_CancerGov_QA,0000004_3.xml,0000004_3,CancerGov,https://www.cancer.gov/types/lymphoma/patient/aids-related-treatment-pdq,AIDS-Related Lymphoma,2,0000004_3-2,symptoms,What are the symptoms of AIDS-Related Lymphoma ?,"Signs of AIDS-related lymphoma include weight loss, fever, and night sweats. These and other signs and symptoms may be caused by AIDS-related lymphoma or by other conditions. Check with your doctor if you have any of the following:         - Weight loss or fever for no known reason.    - Night sweats.    - Painless, swollen lymph nodes in the neck, chest, underarm, or groin.    -  A feeling of fullness below the ribs.","Pt presents with Weight loss or fever for no known reason, Night sweats, Painless, swollen lymph nodes in the neck, chest, underarm, or groin, A feeling of fullness below the ribs.",2,-0.39119506,-0.14940289
1_CancerGov_QA,0000004_4.xml,0000004_4,CancerGov,https://www.cancer.gov/types/lymphoma/patient/mycosis-fungoides-treatment-pdq,Mycosis Fungoides and the Szary Syndrome,2,0000004_4-2,symptoms,What are the symptoms of Mycosis Fungoides and the Szary Syndrome ?,"A sign of mycosis fungoides is a red rash on the skin. Mycosis fungoides may go through the following phases:         -  Premycotic phase: A scaly, red rash in areas of the body that usually are not exposed to the sun. This rash does not cause symptoms and may last for months or years. It is hard to diagnose the rash as mycosis fungoides during this phase.    -  Patch phase: Thin, reddened, eczema -like rash.    -  Plaque phase: Small raised bumps (papules) or hardened lesions on the skin, which may be reddened.     -  Tumor phase: Tumors form on the skin. These tumors may develop ulcers and the skin may get infected.        Check with your doctor if you have any of these signs.","Pt presents with Patch phase: Thin, reddened, eczema -like rash.",4,0.022971353,-0.18551038
1_CancerGov_QA,0000004_6.xml,0000004_6,CancerGov,https://www.cancer.gov/types/lymphoma/patient/child-hodgkin-treatment-pdq,Childhood Hodgkin Lymphoma,3,0000004_6-3,symptoms,What are the symptoms of Childhood Hodgkin Lymphoma ?,"Signs of childhood Hodgkin lymphoma include swollen lymph nodes, fever, night sweats, and weight loss. These and other signs and symptoms may be caused by childhood Hodgkin lymphoma or by other conditions. Check with your child's doctor if your child has any of the following:         - Painless, swollen lymph nodes near the collarbone or in the neck, chest, underarm, or groin.    -  Fever for no known reason.     - Weight loss for no known reason.    - Night sweats.    -  Fatigue.    -  Anorexia.    - Itchy skin.    - Pain in the lymph nodes after drinking alcohol.        Fever, weight loss, and night sweats are called B symptoms.","Pt presents with Fever for no known reason, Weight loss for no known reason, Night sweats, Fatigue, Anorexia, Itchy skin.",2,-0.2815539,0.016909583
1_CancerGov_QA,0000004_7.xml,0000004_7,CancerGov,https://www.cancer.gov/types/lymphoma/patient/child-nhl-treatment-pdq,Childhood Non-Hodgkin Lymphoma,2,0000004_7-2,symptoms,What are the symptoms of Childhood Non-Hodgkin Lymphoma ?,"Signs of childhood non-Hodgkin lymphoma include breathing problems and swollen lymph nodes. These and other signs may be caused by childhood non-Hodgkin lymphoma or by other conditions. Check with a doctor if your child has any of the following:         - Trouble breathing.    - Wheezing.    - Coughing.    -  High-pitched breathing sounds.    - Swelling of the head, neck, upper body, or arms.    - Trouble swallowing.    - Painless swelling of the lymph nodes in the neck, underarm, stomach, or groin.    - Painless lump or swelling in a testicle.     -  Fever for no known reason.    - Weight loss for no known reason.    - Night sweats.","Pt presents with Trouble breathing, Wheezing, Coughing, High-pitched breathing sounds, Swelling of the head, neck, upper body, or arms, Trouble swallowing.",1,-0.21295762,0.1929189
1_CancerGov_QA,0000005_1.xml,0000005_1,CancerGov,https://www.cancer.gov/types/anal/patient/anal-treatment-pdq,Anal Cancer,3,0000005_1-3,symptoms,What are the symptoms of Anal Cancer ?,Signs of anal cancer include bleeding from the anus or rectum or a lump near the anus. These and other signs and symptoms may be caused by anal cancer or by other conditions. Check with your doctor if you have any of the following:          - Bleeding from the anus or rectum.    - Pain or pressure in the area around the anus.    - Itching or discharge from the anus.    - A lump near the anus.    - A change in bowel habits.,"Pt presents with Bleeding from the anus or rectum, Pain or pressure in the area around the anus, Itching or discharge from the anus, A lump near the anus, A change in bowel habits.",2,-0.1955061,-0.22779648
1_CancerGov_QA,0000006_1.xml,0000006_1,CancerGov,https://www.cancer.gov/types/brain/patient/adult-brain-treatment-pdq,Adult Central Nervous System Tumors,4,0000006_1-4,symptoms,What are the symptoms of Adult Central Nervous System Tumors ?,"The signs and symptoms of adult brain and spinal cord tumors are not the same in every person. Signs and symptoms depend on the following:         - Where the tumor forms in the brain or spinal cord.    - What the affected part of the brain controls.    - The size of the tumor.        Signs and symptoms may be caused by CNS tumors or by other conditions, including cancer that has spread to the brain. Check with your doctor if you have any of the following:      Brain Tumor Symptoms       - Morning headache or headache that goes away after vomiting.    -  Seizures.    - Vision, hearing, and speech problems.    - Loss of appetite.    - Frequent nausea and vomiting.     - Changes in personality, mood, ability to focus, or behavior.    - Loss of balance and trouble walking.    - Weakness.    - Unusual sleepiness or change in activity level.            Spinal Cord Tumor Symptoms       - Back pain or pain that spreads from the back towards the arms or legs.    - A change in bowel habits or trouble urinating.    - Weakness or numbness in the arms or legs.    - Trouble walking.","Pt presents with Brain Tumor Symptoms, Morning headache or headache that goes away after vomiting, Seizures, Vision, hearing, and speech problems, Loss of appetite, Frequent nausea and vomiting.",1,-0.2525169,0.30022162
1_CancerGov_QA,0000006_2.xml,0000006_2,CancerGov,https://www.cancer.gov/types/brain/patient/child-brain-treatment-pdq,Childhood Brain and Spinal Cord Tumors,3,0000006_2-3,symptoms,What are the symptoms of Childhood Brain and Spinal Cord Tumors ?,"The signs and symptoms of childhood brain and spinal cord tumors are not the same in every child. Signs and symptoms depend on the following:         - Where the tumor forms in the brain or spinal cord.    - The size of the tumor.    - How fast the tumor grows.    - The child's age and development.        Signs and symptoms may be caused by childhood brain and spinal cord tumors or by other conditions, including cancer that has spread to the brain. Check with your child's doctor if your child has any of the following:      Brain Tumor Signs and Symptoms       - Morning headache or headache that goes away after vomiting.    - Frequent nausea and vomiting.     - Vision, hearing, and speech problems.    - Loss of balance and trouble walking.    - Unusual sleepiness or change in activity level.     - Unusual changes in personality or behavior.    -  Seizures.    - Increase in the head size (in infants).           Spinal Cord Tumor Signs and Symptoms       - Back pain or pain that spreads from the back towards the arms or legs.    - A change in bowel habits or trouble urinating.    - Weakness in the legs.    - Trouble walking.        In addition to these signs and symptoms of brain and spinal cord tumors, some children are unable to reach certain growth and development milestones such as sitting up, walking, and talking in sentences.","Pt presents with Where the tumor forms in the brain or spinal cord, The size of the tumor, How fast the tumor grows, The child's age and development, Brain Tumor Signs and Symptoms, Morning headache or headache that goes away after vomiting.",1,-0.093223885,0.12488359
1_CancerGov_QA,0000006_3.xml,0000006_3,CancerGov,https://www.cancer.gov/types/brain/patient/child-astrocytoma-treament-pdq,Childhood Astrocytomas,4,0000006_3-4,symptoms,What are the symptoms of Childhood Astrocytomas ?,"The signs and symptoms of astrocytomas are not the same in every child. Signs and symptoms depend on the following:          - Where the tumor forms in the brain or spinal cord.    - The size of the tumor.    - How fast the tumor grows.    - The child's age and development.        Some tumors do not cause signs or symptoms. Signs and symptoms may be caused by childhood astrocytomas or by other conditions. Check with your child's doctor if your child has any of the following:         - Morning headache or headache that goes away after vomiting.    -  Nausea and vomiting.    - Vision, hearing, and speech problems.     - Loss of balance and trouble walking.     - Worsening handwriting or slow speech.    - Weakness or change in feeling on one side of the body.    - Unusual sleepiness.    - More or less energy than usual.    - Change in personality or behavior.    -  Seizures.    - Weight loss or weight gain for no known reason.     - Increase in the size of the head (in infants).","Pt presents with Where the tumor forms in the brain or spinal cord, The size of the tumor, How fast the tumor grows, The child's age and development, Morning headache or headache that goes away after vomiting, Nausea and vomiting.",1,-0.086603716,0.11418447
1_CancerGov_QA,0000006_4.xml,0000006_4,CancerGov,https://www.cancer.gov/types/brain/patient/child-cns-atrt-treatment-pdq,Childhood Central Nervous System Atypical Teratoid/Rhabdoid Tumor,3,0000006_4-3,symptoms,What are the symptoms of Childhood Central Nervous System Atypical Teratoid/Rhabdoid Tumor ?,"The signs and symptoms of atypical teratoid/rhabdoid tumor are not the same in every patient. Signs and symptoms depend on the following:         - The child's age.    - Where the tumor has formed.        Because atypical teratoid/rhabdoid tumor is fast growing, signs and symptoms may develop quickly and get worse over a period of days or weeks. Signs and symptoms may be caused by AT/RT or by other conditions. Check with your child's doctor if your child has any of the following:         - Morning headache or headache that goes away after vomiting.    -  Nausea and vomiting.    - Unusual sleepiness or change in activity level.    - Loss of balance, lack of coordination, or trouble walking.    - Increase in head size (in infants).","Pt presents with The child's age, Where the tumor has formed, Morning headache or headache that goes away after vomiting, Nausea and vomiting, Unusual sleepiness or change in activity level, Loss of balance, lack of coordination, or trouble walking.",1,-0.18194294,0.16282772
1_CancerGov_QA,0000006_5.xml,0000006_5,CancerGov,https://www.cancer.gov/types/brain/patient/child-glioma-treatment-pdq,Childhood Brain Stem Glioma,4,0000006_5-4,symptoms,What are the symptoms of Childhood Brain Stem Glioma ?,The signs and symptoms of brain stem glioma are not the same in every child. Signs and symptoms depend on the following:          - Where the tumor forms in the brain.    - The size of the tumor and whether it has spread all through the brain stem.    - How fast the tumor grows.    - The child's age and development.        Some tumors do not cause signs or symptoms. Signs and symptoms may be caused by childhood brain stem gliomas or by other conditions. Check with your child's doctor if your child has any of the following:         - Loss of ability to move one side of the face and/or body.    - Loss of balance and trouble walking.     - Vision and hearing problems.    - Morning headache or headache that goes away after vomiting.    -  Nausea and vomiting.    - Unusual sleepiness.    - More or less energy than usual.    - Changes in behavior.    - Trouble learning in school.,"Pt presents with Where the tumor forms in the brain, How fast the tumor grows, The child's age and development, Loss of ability to move one side of the face and/or body, Loss of balance and trouble walking, Vision and hearing problems.",1,0.14116302,0.10788752
