source_folder,file_name,document_id,source,url,focus,pid,qid,qtype,question,answer,clinical_note,cluster,pca_x,pca_y
2_GARD_QA,0000210.xml,0000210,GARD,https://rarediseases.info.nih.gov/gard/804/alagille-syndrome,Alagille syndrome,2,0000210-2,symptoms,What are the symptoms of Alagille syndrome ?,"What are the signs and symptoms of Alagille syndrome? Alagille syndrome is a complex multisystem disorder involving the liver, heart, eyes, face, and skeleton. Symptoms typically present in infancy or early childhood. The severity of the disorder varies among affected individuals, even within the same family. Symptoms range from so mild as to go unnoticed to severe enough to require heart and/or liver transplants. One of the major features of Alagille syndrome is liver damage caused by abnormalities in the bile ducts. These ducts carry bile (which helps to digest fats) from the liver to the gallbladder and small intestine. In Alagille syndrome, the bile ducts may be narrow, malformed, and reduced in number. This results in a build-up of  bile causing scarring that prevents the liver from working properly. This may lead to jaundice, itchy skin, and deposits of cholesterol in the skin (xanthomas). Alagille syndrome is also associated with several heart problems, including impaired blood flow from the heart into the lungs (pulmonic stenosis). Other heart-related problems include a hole between the two lower chambers of the heart (ventricular septal defect) and a combination of heart defects called tetralogy of Fallot. People with Alagille syndrome may also have distinctive facial features (including a broad, prominent forehead; deep-set eyes; and a small, pointed chin), problems with the blood vessels within the brain and spinal cord (central nervous system) and the kidneys, and an unusual butterfly shape of the bones of the spinal column (vertebrae). Detailed information about the symptoms associated with Allagille syndrome can be accessed through the National Digestive Diseases Information Clearinghouse (NDDIC) and GeneReviews. The Human Phenotype Ontology provides the following list of signs and symptoms for Alagille syndrome. If the information is available, the table below includes how often the symptom is seen in people with this condition. You can use the MedlinePlus Medical Dictionary to look up the definitions for these medical terms. Signs and Symptoms Approximate number of patients (when available) Biliary tract abnormality 90% Corneal dystrophy 90% Hepatomegaly 90% Ventricular septal defect 90% Abnormal form of the vertebral bodies 50% Abnormal nasal morphology 50% Abnormality of the pinna 50% Coarse facial features 50% Frontal bossing 50% Intrauterine growth retardation 50% Pointed chin 50% Round face 50% Spina bifida occulta 50% Telangiectasia of the skin 50% Vertebral segmentation defect 50% Abnormality of chromosome segregation 7.5% Abnormality of the pulmonary artery 7.5% Abnormality of the pupil 7.5% Abnormality of the ribs 7.5% Abnormality of the ulna 7.5% Abnormality of the ureter 7.5% Atria septal defect 7.5% Clinodactyly of the 5th finger 7.5% Cognitive impairment 7.5% Cryptorchidism 7.5% Decreased corneal thickness 7.5% Deeply set eye 7.5% Delayed skeletal maturation 7.5% Hypertelorism 7.5% Hypertension 7.5% Intellectual disability, mild 7.5% Malar flattening 7.5% Nephrotic syndrome 7.5% Renal hypoplasia/aplasia 7.5% Short distal phalanx of finger 7.5% Short philtrum 7.5% Strabismus 7.5% Areflexia - Autosomal dominant inheritance - Axenfeld anomaly - Band keratopathy - Broad forehead - Butterfly vertebral arch - Cataract - Chorioretinal atrophy - Cirrhosis - Coarctation of aorta - Depressed nasal bridge - Elevated hepatic transaminases - Exocrine pancreatic insufficiency - Failure to thrive - Hemivertebrae - Hepatocellular carcinoma - Hypercholesterolemia - Hypertriglyceridemia - Hypoplasia of the ulna - Incomplete penetrance - Infantile onset - Long nose - Macrotia - Microcornea - Multiple small medullary renal cysts - Myopia - Papillary thyroid carcinoma - Peripheral pulmonary artery stenosis - Pigmentary retinal deposits - Posterior embryotoxon - Prolonged neonatal jaundice - Reduced number of intrahepatic bile ducts - Renal dysplasia - Renal hypoplasia - Renal tubular acidosis - Specific learning disability - Stroke - Tetralogy of Fallot - Triangular face - Upslanted palpebral fissure - Vesicoureteral reflux - The Human Phenotype Ontology (HPO) has collected information on how often a sign or symptom occurs in a condition. Much of this information comes from Orphanet, a European rare disease database. The frequency of a sign or symptom is usually listed as a rough estimate of the percentage of patients who have that feature. The frequency may also be listed as a fraction. The first number of the fraction is how many people had the symptom, and the second number is the total number of people who were examined in one study. For example, a frequency of 25/25 means that in a study of 25 people all patients were found to have that symptom. Because these frequencies are based on a specific study, the fractions may be different if another group of patients are examined. Sometimes, no information on frequency is available. In these cases, the sign or symptom may be rare or common.","Pt presents with Axenfeld anomaly, Band keratopathy, Broad forehead, Butterfly vertebral arch, Cataract, Chorioretinal atrophy.",0,0.33062884,0.10242515
2_GARD_QA,0000212.xml,0000212,GARD,https://rarediseases.info.nih.gov/gard/5026/alaninuria-with-microcephaly-dwarfism-enamel-hypoplasia-and-diabetes-mellitus,"Alaninuria with microcephaly, dwarfism, enamel hypoplasia and diabetes mellitus",1,0000212-1,symptoms,"What are the symptoms of Alaninuria with microcephaly, dwarfism, enamel hypoplasia and diabetes mellitus ?","What are the signs and symptoms of Alaninuria with microcephaly, dwarfism, enamel hypoplasia and diabetes mellitus? The Human Phenotype Ontology provides the following list of signs and symptoms for Alaninuria with microcephaly, dwarfism, enamel hypoplasia and diabetes mellitus. If the information is available, the table below includes how often the symptom is seen in people with this condition. You can use the MedlinePlus Medical Dictionary to look up the definitions for these medical terms. Signs and Symptoms Approximate number of patients (when available) Abnormality of dental enamel 90% Aminoaciduria 90% Cognitive impairment 90% Incoordination 90% Intrauterine growth retardation 90% Microcephaly 90% Microdontia 90% Short stature 90% Type II diabetes mellitus 90% Autosomal recessive inheritance - Diabetes mellitus - Hypoplasia of dental enamel - Lactic acidosis - Severe short stature - The Human Phenotype Ontology (HPO) has collected information on how often a sign or symptom occurs in a condition. Much of this information comes from Orphanet, a European rare disease database. The frequency of a sign or symptom is usually listed as a rough estimate of the percentage of patients who have that feature. The frequency may also be listed as a fraction. The first number of the fraction is how many people had the symptom, and the second number is the total number of people who were examined in one study. For example, a frequency of 25/25 means that in a study of 25 people all patients were found to have that symptom. Because these frequencies are based on a specific study, the fractions may be different if another group of patients are examined. Sometimes, no information on frequency is available. In these cases, the sign or symptom may be rare or common.","Pt presents with Diabetes mellitus, Hypoplasia of dental enamel, Lactic acidosis, Severe short stature.",3,0.24108583,-0.070401646
2_GARD_QA,0000219.xml,0000219,GARD,https://rarediseases.info.nih.gov/gard/5770/albrights-hereditary-osteodystrophy,Albright's hereditary osteodystrophy,2,0000219-2,symptoms,What are the symptoms of Albright's hereditary osteodystrophy ?,"What are the signs and symptoms of Albright's hereditary osteodystrophy? Albright's hereditary osteodystophy is a genetic disorder that can cause many different symptoms. People with this disorder usually have short stature, obesity, round face, short bones in the hands and feet (brachydactyly), subcutaneous (under the skin) ossifications (replacement of cartilage by bone), and dimples on affected knuckles. Some people may have mild developmental delay. People with this disorder usually are resistant to parathyroid hormone (which is a condition called pseudohypoparathyroidism). This causes low levels of calcium in the bones and the blood. Low levels of calcium in the blood (hypocalcemia) can cause numbness, seizures, cataracts (cloudy lens in the eye), dental issues, and tetany (muscle twitches and hand and foot spasms). The Human Phenotype Ontology provides the following list of signs and symptoms for Albright's hereditary osteodystrophy. If the information is available, the table below includes how often the symptom is seen in people with this condition. You can use the MedlinePlus Medical Dictionary to look up the definitions for these medical terms. Signs and Symptoms Approximate number of patients (when available) Abnormal joint morphology 90% Abnormality of calcium-phosphate metabolism 90% Cafe-au-lait spot 90% Gynecomastia 90% Hyperphosphatemia 90% Hyperthyroidism 90% Obesity 90% Precocious puberty 90% Round face 90% Skeletal dysplasia 90% Abnormality of the menstrual cycle 50% Abnormality of the penis 50% Coarse facial features 50% Cognitive impairment 50% Dry skin 50% Goiter 50% Scoliosis 50% Thin skin 50% Abnormality of the hip bone 7.5% Alopecia 7.5% Craniofacial hyperostosis 7.5% Hearing impairment 7.5% Neoplasm of the breast 7.5% Neoplasm of the thyroid gland 7.5% Polycystic ovaries 7.5% Recurrent fractures 7.5% Sarcoma 7.5% Testicular neoplasm 7.5% Visual impairment 7.5% Autosomal dominant inheritance - Basal ganglia calcification - Brachydactyly syndrome - Cataract - Choroid plexus calcification - Delayed eruption of teeth - Depressed nasal bridge - Elevated circulating parathyroid hormone (PTH) level - Full cheeks - Hypocalcemic tetany - Hypogonadism - Hypoplasia of dental enamel - Hypothyroidism - Intellectual disability - Low urinary cyclic AMP response to PTH administration - Nystagmus - Osteoporosis - Phenotypic variability - Pseudohypoparathyroidism - Seizures - Short finger - Short metacarpal - Short metatarsal - Short neck - Short stature - Short toe - Thickened calvaria - The Human Phenotype Ontology (HPO) has collected information on how often a sign or symptom occurs in a condition. Much of this information comes from Orphanet, a European rare disease database. The frequency of a sign or symptom is usually listed as a rough estimate of the percentage of patients who have that feature. The frequency may also be listed as a fraction. The first number of the fraction is how many people had the symptom, and the second number is the total number of people who were examined in one study. For example, a frequency of 25/25 means that in a study of 25 people all patients were found to have that symptom. Because these frequencies are based on a specific study, the fractions may be different if another group of patients are examined. Sometimes, no information on frequency is available. In these cases, the sign or symptom may be rare or common.","Pt presents with Basal ganglia calcification, Brachydactyly syndrome, Cataract, Choroid plexus calcification, Delayed eruption of teeth, Depressed nasal bridge.",0,0.17021674,0.18923026
2_GARD_QA,0000241.xml,0000241,GARD,https://rarediseases.info.nih.gov/gard/5782/alopecia-areata,Alopecia areata,2,0000241-2,symptoms,What are the symptoms of Alopecia areata ?,"What are the signs and symptoms of Alopecia areata? The Human Phenotype Ontology provides the following list of signs and symptoms for Alopecia areata. If the information is available, the table below includes how often the symptom is seen in people with this condition. You can use the MedlinePlus Medical Dictionary to look up the definitions for these medical terms. Signs and Symptoms Approximate number of patients (when available) Alopecia areata - Alopecia totalis - Autoimmunity - Multifactorial inheritance - Nail pits - The Human Phenotype Ontology (HPO) has collected information on how often a sign or symptom occurs in a condition. Much of this information comes from Orphanet, a European rare disease database. The frequency of a sign or symptom is usually listed as a rough estimate of the percentage of patients who have that feature. The frequency may also be listed as a fraction. The first number of the fraction is how many people had the symptom, and the second number is the total number of people who were examined in one study. For example, a frequency of 25/25 means that in a study of 25 people all patients were found to have that symptom. Because these frequencies are based on a specific study, the fractions may be different if another group of patients are examined. Sometimes, no information on frequency is available. In these cases, the sign or symptom may be rare or common.","Pt presents with Alopecia totalis, Autoimmunity, Nail pits.",4,0.19460155,-0.14978454
2_GARD_QA,0000242.xml,0000242,GARD,https://rarediseases.info.nih.gov/gard/606/alopecia-epilepsy-oligophrenia-syndrome-of-moynahan,Alopecia epilepsy oligophrenia syndrome of Moynahan,1,0000242-1,symptoms,What are the symptoms of Alopecia epilepsy oligophrenia syndrome of Moynahan ?,"What are the signs and symptoms of Alopecia epilepsy oligophrenia syndrome of Moynahan? The Human Phenotype Ontology provides the following list of signs and symptoms for Alopecia epilepsy oligophrenia syndrome of Moynahan. If the information is available, the table below includes how often the symptom is seen in people with this condition. You can use the MedlinePlus Medical Dictionary to look up the definitions for these medical terms. Signs and Symptoms Approximate number of patients (when available) Alopecia 90% Cognitive impairment 90% Abnormality of the genital system 50% Decreased body weight 50% Microcephaly 50% Seizures 50% Short stature 50% Hyperkeratosis 7.5% Sensorineural hearing impairment 7.5% Autosomal recessive inheritance - EEG abnormality - Intellectual disability - Sparse hair - The Human Phenotype Ontology (HPO) has collected information on how often a sign or symptom occurs in a condition. Much of this information comes from Orphanet, a European rare disease database. The frequency of a sign or symptom is usually listed as a rough estimate of the percentage of patients who have that feature. The frequency may also be listed as a fraction. The first number of the fraction is how many people had the symptom, and the second number is the total number of people who were examined in one study. For example, a frequency of 25/25 means that in a study of 25 people all patients were found to have that symptom. Because these frequencies are based on a specific study, the fractions may be different if another group of patients are examined. Sometimes, no information on frequency is available. In these cases, the sign or symptom may be rare or common.","Pt presents with EEG abnormality, Intellectual disability, Sparse hair.",0,0.32129312,0.23761368
2_GARD_QA,0000244.xml,0000244,GARD,https://rarediseases.info.nih.gov/gard/4291/alopecia-intellectual-disability-syndrome-2,Alopecia intellectual disability syndrome 2,1,0000244-1,symptoms,What are the symptoms of Alopecia intellectual disability syndrome 2 ?,"What are the signs and symptoms of Alopecia intellectual disability syndrome 2? The Human Phenotype Ontology provides the following list of signs and symptoms for Alopecia intellectual disability syndrome 2. If the information is available, the table below includes how often the symptom is seen in people with this condition. You can use the MedlinePlus Medical Dictionary to look up the definitions for these medical terms. Signs and Symptoms Approximate number of patients (when available) Alopecia universalis - Autosomal recessive inheritance - Intellectual disability - The Human Phenotype Ontology (HPO) has collected information on how often a sign or symptom occurs in a condition. Much of this information comes from Orphanet, a European rare disease database. The frequency of a sign or symptom is usually listed as a rough estimate of the percentage of patients who have that feature. The frequency may also be listed as a fraction. The first number of the fraction is how many people had the symptom, and the second number is the total number of people who were examined in one study. For example, a frequency of 25/25 means that in a study of 25 people all patients were found to have that symptom. Because these frequencies are based on a specific study, the fractions may be different if another group of patients are examined. Sometimes, no information on frequency is available. In these cases, the sign or symptom may be rare or common.",Pt presents with Intellectual disability.,0,0.2938092,0.2317783
2_GARD_QA,0000245.xml,0000245,GARD,https://rarediseases.info.nih.gov/gard/610/alopecia-macular-degeneration-growth-retardation,Alopecia macular degeneration growth retardation,1,0000245-1,symptoms,What are the symptoms of Alopecia macular degeneration growth retardation ?,"What are the signs and symptoms of Alopecia macular degeneration growth retardation? The Human Phenotype Ontology provides the following list of signs and symptoms for Alopecia macular degeneration growth retardation. If the information is available, the table below includes how often the symptom is seen in people with this condition. You can use the MedlinePlus Medical Dictionary to look up the definitions for these medical terms. Signs and Symptoms Approximate number of patients (when available) Abnormal hair quantity 90% Abnormality of retinal pigmentation 90% Abnormality of the macula 90% Retinopathy 90% Split hand 90% Aplasia/Hypoplasia of the eyebrow 50% Carious teeth 50% Finger syndactyly 50% Microdontia 50% Reduced number of teeth 50% Strabismus 7.5% Autosomal recessive inheritance - Camptodactyly - Ectodermal dysplasia - Joint contracture of the hand - Macular dystrophy - Selective tooth agenesis - Sparse eyebrow - Sparse eyelashes - Sparse scalp hair - Syndactyly - Widely spaced teeth - The Human Phenotype Ontology (HPO) has collected information on how often a sign or symptom occurs in a condition. Much of this information comes from Orphanet, a European rare disease database. The frequency of a sign or symptom is usually listed as a rough estimate of the percentage of patients who have that feature. The frequency may also be listed as a fraction. The first number of the fraction is how many people had the symptom, and the second number is the total number of people who were examined in one study. For example, a frequency of 25/25 means that in a study of 25 people all patients were found to have that symptom. Because these frequencies are based on a specific study, the fractions may be different if another group of patients are examined. Sometimes, no information on frequency is available. In these cases, the sign or symptom may be rare or common.","Pt presents with Camptodactyly, Ectodermal dysplasia, Joint contracture of the hand, Macular dystrophy, Selective tooth agenesis, Sparse eyebrow.",4,0.4426113,-0.046290047
2_GARD_QA,0000246.xml,0000246,GARD,https://rarediseases.info.nih.gov/gard/613/alopecia-totalis,Alopecia totalis,2,0000246-2,symptoms,What are the symptoms of Alopecia totalis ?,"What are the signs and symptoms of Alopecia totalis? The Human Phenotype Ontology provides the following list of signs and symptoms for Alopecia totalis. If the information is available, the table below includes how often the symptom is seen in people with this condition. You can use the MedlinePlus Medical Dictionary to look up the definitions for these medical terms. Signs and Symptoms Approximate number of patients (when available) Alopecia areata - Alopecia totalis - Autoimmunity - Multifactorial inheritance - Nail pits - The Human Phenotype Ontology (HPO) has collected information on how often a sign or symptom occurs in a condition. Much of this information comes from Orphanet, a European rare disease database. The frequency of a sign or symptom is usually listed as a rough estimate of the percentage of patients who have that feature. The frequency may also be listed as a fraction. The first number of the fraction is how many people had the symptom, and the second number is the total number of people who were examined in one study. For example, a frequency of 25/25 means that in a study of 25 people all patients were found to have that symptom. Because these frequencies are based on a specific study, the fractions may be different if another group of patients are examined. Sometimes, no information on frequency is available. In these cases, the sign or symptom may be rare or common.","Pt presents with Alopecia totalis, Autoimmunity, Nail pits.",4,0.19460155,-0.14978454
2_GARD_QA,0000247.xml,0000247,GARD,https://rarediseases.info.nih.gov/gard/614/alopecia-universalis,Alopecia universalis,2,0000247-2,symptoms,What are the symptoms of Alopecia universalis ?,"What are the signs and symptoms of Alopecia universalis? Alopecia universalis (AU) is characterized by the complete loss of hair on both the scalp and body. Most people with AU do not have other signs and symptoms, but some may experience a burning sensation or itching on affected areas. In some cases, AU can be associated with other conditions such as atopic dermatitis, thyroid disorders, and/or nail changes (such as pitting). Anxiety, personality disorders, depression, and paranoid disorders are more common in people with different forms of alopecia areata. The Human Phenotype Ontology provides the following list of signs and symptoms for Alopecia universalis. If the information is available, the table below includes how often the symptom is seen in people with this condition. You can use the MedlinePlus Medical Dictionary to look up the definitions for these medical terms. Signs and Symptoms Approximate number of patients (when available) Alopecia areata - Alopecia totalis - Autoimmunity - Multifactorial inheritance - Nail pits - The Human Phenotype Ontology (HPO) has collected information on how often a sign or symptom occurs in a condition. Much of this information comes from Orphanet, a European rare disease database. The frequency of a sign or symptom is usually listed as a rough estimate of the percentage of patients who have that feature. The frequency may also be listed as a fraction. The first number of the fraction is how many people had the symptom, and the second number is the total number of people who were examined in one study. For example, a frequency of 25/25 means that in a study of 25 people all patients were found to have that symptom. Because these frequencies are based on a specific study, the fractions may be different if another group of patients are examined. Sometimes, no information on frequency is available. In these cases, the sign or symptom may be rare or common.","Pt presents with Alopecia totalis, Autoimmunity, Nail pits.",4,0.19460155,-0.14978454
2_GARD_QA,0000249.xml,0000249,GARD,https://rarediseases.info.nih.gov/gard/607/alopecia-epilepsy-pyorrhea-mental-subnormality,"Alopecia, epilepsy, pyorrhea, mental subnormality",1,0000249-1,symptoms,"What are the symptoms of Alopecia, epilepsy, pyorrhea, mental subnormality ?","What are the signs and symptoms of Alopecia, epilepsy, pyorrhea, mental subnormality? The Human Phenotype Ontology provides the following list of signs and symptoms for Alopecia, epilepsy, pyorrhea, mental subnormality. If the information is available, the table below includes how often the symptom is seen in people with this condition. You can use the MedlinePlus Medical Dictionary to look up the definitions for these medical terms. Signs and Symptoms Approximate number of patients (when available) Abnormality of the eyelashes 90% Abnormality of the teeth 90% Alopecia 90% Aplasia/Hypoplasia of the eyebrow 90% EEG abnormality 90% Gingivitis 90% Memory impairment 90% Seizures 50% Hearing impairment 7.5% Hydrocephalus 7.5% Melanocytic nevus 7.5% Alopecia universalis - Autosomal dominant inheritance - Congenital alopecia totalis - Intellectual disability, mild - Periodontitis - The Human Phenotype Ontology (HPO) has collected information on how often a sign or symptom occurs in a condition. Much of this information comes from Orphanet, a European rare disease database. The frequency of a sign or symptom is usually listed as a rough estimate of the percentage of patients who have that feature. The frequency may also be listed as a fraction. The first number of the fraction is how many people had the symptom, and the second number is the total number of people who were examined in one study. For example, a frequency of 25/25 means that in a study of 25 people all patients were found to have that symptom. Because these frequencies are based on a specific study, the fractions may be different if another group of patients are examined. Sometimes, no information on frequency is available. In these cases, the sign or symptom may be rare or common.","Pt presents with Congenital alopecia totalis, Intellectual disability, mild, Periodontitis.",4,0.40418604,-0.022789856
