source_folder,file_name,document_id,source,url,focus,pid,qid,qtype,question,answer,clinical_note,cluster,pca_x,pca_y
2_GARD_QA,0000070.xml,0000070,GARD,https://rarediseases.info.nih.gov/gard/2096/acrocephalopolydactylous-dysplasia,Acrocephalopolydactylous dysplasia,1,0000070-1,symptoms,What are the symptoms of Acrocephalopolydactylous dysplasia ?,"What are the signs and symptoms of Acrocephalopolydactylous dysplasia? The Human Phenotype Ontology provides the following list of signs and symptoms for Acrocephalopolydactylous dysplasia. If the information is available, the table below includes how often the symptom is seen in people with this condition. You can use the MedlinePlus Medical Dictionary to look up the definitions for these medical terms. Signs and Symptoms Approximate number of patients (when available) Omphalocele 30% Pancreatic fibrosis 30% Abnormality of the pinna - Ascites - Autosomal recessive inheritance - Craniosynostosis - Cystic renal dysplasia - Enlarged kidneys - Epicanthus - Extrapulmonary sequestrum - Hepatic fibrosis - Hepatomegaly - Hypertelorism - Hypoplasia of the small intestine - Hypoplastic colon - Low-set ears - Micromelia - Oxycephaly - Phenotypic variability - Polysplenia - Postaxial hand polydactyly - Pulmonary hypoplasia - Short neck - Short nose - Upslanted palpebral fissure - The Human Phenotype Ontology (HPO) has collected information on how often a sign or symptom occurs in a condition. Much of this information comes from Orphanet, a European rare disease database. The frequency of a sign or symptom is usually listed as a rough estimate of the percentage of patients who have that feature. The frequency may also be listed as a fraction. The first number of the fraction is how many people had the symptom, and the second number is the total number of people who were examined in one study. For example, a frequency of 25/25 means that in a study of 25 people all patients were found to have that symptom. Because these frequencies are based on a specific study, the fractions may be different if another group of patients are examined. Sometimes, no information on frequency is available. In these cases, the sign or symptom may be rare or common.","Pt presents with Ascites, Craniosynostosis, Cystic renal dysplasia, Enlarged kidneys, Epicanthus, Extrapulmonary sequestrum.",3,0.15500998,-0.06512636
2_GARD_QA,0000073.xml,0000073,GARD,https://rarediseases.info.nih.gov/gard/5723/acrodermatitis-enteropathica,Acrodermatitis enteropathica,2,0000073-2,symptoms,What are the symptoms of Acrodermatitis enteropathica ?,"What are the signs and symptoms of Acrodermatitis enteropathica? The Human Phenotype Ontology provides the following list of signs and symptoms for Acrodermatitis enteropathica. If the information is available, the table below includes how often the symptom is seen in people with this condition. You can use the MedlinePlus Medical Dictionary to look up the definitions for these medical terms. Signs and Symptoms Approximate number of patients (when available) Abnormal blistering of the skin 90% Abnormality of the eyebrow 90% Alopecia 90% Cerebral cortical atrophy 90% Diarrhea 90% Dry skin 90% Malabsorption 90% Pustule 90% Short stature 90% Abnormality of the fingernails 50% Abnormality of the toenails 50% Cheilitis 50% Furrowed tongue 50% Glossitis 50% Inflammatory abnormality of the eye 50% Photophobia 50% Skin ulcer 50% Anorexia 7.5% Corneal erosion 7.5% Visual impairment 7.5% Weight loss 7.5% Alopecia of scalp - Ataxia - Autosomal recessive inheritance - Decreased taste sensation - Decreased testicular size - Decreased testosterone in males - Emotional lability - Failure to thrive - Hepatomegaly - Hypogonadism - Impaired T cell function - Infantile onset - Irritability - Lethargy - Low alkaline phosphatase - Paronychia - Poor appetite - Recurrent candida infections - Splenomegaly - Tremor - The Human Phenotype Ontology (HPO) has collected information on how often a sign or symptom occurs in a condition. Much of this information comes from Orphanet, a European rare disease database. The frequency of a sign or symptom is usually listed as a rough estimate of the percentage of patients who have that feature. The frequency may also be listed as a fraction. The first number of the fraction is how many people had the symptom, and the second number is the total number of people who were examined in one study. For example, a frequency of 25/25 means that in a study of 25 people all patients were found to have that symptom. Because these frequencies are based on a specific study, the fractions may be different if another group of patients are examined. Sometimes, no information on frequency is available. In these cases, the sign or symptom may be rare or common.","Pt presents with Ataxia, Decreased taste sensation, Decreased testicular size, Decreased testosterone in males, Emotional lability, Failure to thrive.",0,0.0424329,0.1877036
2_GARD_QA,0000084.xml,0000084,GARD,https://rarediseases.info.nih.gov/gard/500/acromegaloid-changes-cutis-verticis-gyrata-and-corneal-leukoma,"Acromegaloid changes, cutis verticis gyrata and corneal leukoma",1,0000084-1,symptoms,"What are the symptoms of Acromegaloid changes, cutis verticis gyrata and corneal leukoma ?","What are the signs and symptoms of Acromegaloid changes, cutis verticis gyrata and corneal leukoma? The Human Phenotype Ontology provides the following list of signs and symptoms for Acromegaloid changes, cutis verticis gyrata and corneal leukoma. If the information is available, the table below includes how often the symptom is seen in people with this condition. You can use the MedlinePlus Medical Dictionary to look up the definitions for these medical terms. Signs and Symptoms Approximate number of patients (when available) Abnormality of the eye - Autosomal dominant inheritance - Cutis gyrata of scalp - Large hands - Mandibular prognathia - Periostosis - Soft skin - Tall stature - The Human Phenotype Ontology (HPO) has collected information on how often a sign or symptom occurs in a condition. Much of this information comes from Orphanet, a European rare disease database. The frequency of a sign or symptom is usually listed as a rough estimate of the percentage of patients who have that feature. The frequency may also be listed as a fraction. The first number of the fraction is how many people had the symptom, and the second number is the total number of people who were examined in one study. For example, a frequency of 25/25 means that in a study of 25 people all patients were found to have that symptom. Because these frequencies are based on a specific study, the fractions may be different if another group of patients are examined. Sometimes, no information on frequency is available. In these cases, the sign or symptom may be rare or common.","Pt presents with Cutis gyrata of scalp, Large hands, Mandibular prognathia, Periostosis, Soft skin, Tall stature.",4,0.28521067,-0.16253398
2_GARD_QA,0000085.xml,0000085,GARD,https://rarediseases.info.nih.gov/gard/501/acromegaloid-facial-appearance-syndrome,Acromegaloid facial appearance syndrome,1,0000085-1,symptoms,What are the symptoms of Acromegaloid facial appearance syndrome ?,"What are the signs and symptoms of Acromegaloid facial appearance syndrome? The Human Phenotype Ontology provides the following list of signs and symptoms for Acromegaloid facial appearance syndrome. If the information is available, the table below includes how often the symptom is seen in people with this condition. You can use the MedlinePlus Medical Dictionary to look up the definitions for these medical terms. Signs and Symptoms Approximate number of patients (when available) Abnormal nasal morphology 90% Abnormality of the nasal alae 90% Abnormality of the tongue 90% Blepharophimosis 90% Coarse facial features 90% Gingival overgrowth 90% Hypertelorism 90% Joint hypermobility 90% Large hands 90% Palpebral edema 90% Thick lower lip vermilion 90% Abnormality of the metacarpal bones 50% Cognitive impairment 50% Craniofacial hyperostosis 50% Highly arched eyebrow 50% Sloping forehead 50% Synophrys 50% Thick eyebrow 50% Thickened skin 50% Intellectual disability, mild 7.5% Seizures 7.5% Specific learning disability 7.5% Tapered finger 7.5% Abnormality of the mouth - Autosomal dominant inheritance - Bulbous nose - Large for gestational age - The Human Phenotype Ontology (HPO) has collected information on how often a sign or symptom occurs in a condition. Much of this information comes from Orphanet, a European rare disease database. The frequency of a sign or symptom is usually listed as a rough estimate of the percentage of patients who have that feature. The frequency may also be listed as a fraction. The first number of the fraction is how many people had the symptom, and the second number is the total number of people who were examined in one study. For example, a frequency of 25/25 means that in a study of 25 people all patients were found to have that symptom. Because these frequencies are based on a specific study, the fractions may be different if another group of patients are examined. Sometimes, no information on frequency is available. In these cases, the sign or symptom may be rare or common.","Pt presents with Bulbous nose, Large for gestational age.",4,0.2031484,-0.10029411
2_GARD_QA,0000088.xml,0000088,GARD,https://rarediseases.info.nih.gov/gard/5725/acromegaly,Acromegaly,2,0000088-2,symptoms,What are the symptoms of Acromegaly ?,"What are the signs and symptoms of Acromegaly? The Human Phenotype Ontology provides the following list of signs and symptoms for Acromegaly. If the information is available, the table below includes how often the symptom is seen in people with this condition. You can use the MedlinePlus Medical Dictionary to look up the definitions for these medical terms. Signs and Symptoms Approximate number of patients (when available) Abnormality of the nose 90% Abnormality of the tongue 90% Anterior hypopituitarism 90% Arthralgia 90% Broad foot 90% Broad forehead 90% Coarse facial features 90% Deep palmar crease 90% Deep plantar creases 90% Full cheeks 90% Hyperhidrosis 90% Joint swelling 90% Macrodactyly of finger 90% Mandibular prognathia 90% Osteoarthritis 90% Tall stature 90% Thick lower lip vermilion 90% Abnormality of the fingernails 50% Abnormality of the menstrual cycle 50% Abnormality of the teeth 50% Abnormality of the toenails 50% Abnormality of the voice 50% Apnea 50% Behavioral abnormality 50% Cerebral palsy 50% Diabetes mellitus 50% Frontal bossing 50% Hypertension 50% Kyphosis 50% Migraine 50% Neoplasm of the endocrine system 50% Palpebral edema 50% Paresthesia 50% Spinal canal stenosis 50% Synophrys 50% Abnormal renal physiology 7.5% Abnormality of reproductive system physiology 7.5% Abnormality of the mitral valve 7.5% Acanthosis nigricans 7.5% Acne 7.5% Erectile abnormalities 7.5% Galactorrhea 7.5% Generalized hyperpigmentation 7.5% Hypertrophic cardiomyopathy 7.5% Reduced consciousness/confusion 7.5% Autosomal dominant inheritance - Cardiomyopathy - Growth hormone excess - Increased serum insulin-like growth factor 1 {comment=""HPO:probinson""} - Left ventricular hypertrophy - Menstrual irregularities - Pituitary adenoma - Pituitary growth hormone cell adenoma - Pituitary prolactin cell adenoma - Prolactin excess - Somatic mutation - The Human Phenotype Ontology (HPO) has collected information on how often a sign or symptom occurs in a condition. Much of this information comes from Orphanet, a European rare disease database. The frequency of a sign or symptom is usually listed as a rough estimate of the percentage of patients who have that feature. The frequency may also be listed as a fraction. The first number of the fraction is how many people had the symptom, and the second number is the total number of people who were examined in one study. For example, a frequency of 25/25 means that in a study of 25 people all patients were found to have that symptom. Because these frequencies are based on a specific study, the fractions may be different if another group of patients are examined. Sometimes, no information on frequency is available. In these cases, the sign or symptom may be rare or common.","Pt presents with Cardiomyopathy, Growth hormone excess, Left ventricular hypertrophy, Menstrual irregularities, Pituitary adenoma, Pituitary growth hormone cell adenoma.",3,0.07254337,-0.0038701112
2_GARD_QA,0000091.xml,0000091,GARD,https://rarediseases.info.nih.gov/gard/6/acromesomelic-dysplasia,Acromesomelic dysplasia,2,0000091-2,symptoms,What are the symptoms of Acromesomelic dysplasia ?,"What are the signs and symptoms of Acromesomelic dysplasia? Affected infants often have a normal birth weight. In most cases, in addition to having unusually short, broad hands and feet, affected infants often have characteristic facial abnormalities that are apparent at birth. Such features may include a relatively enlarged head, unusually prominent forehead, pronounced back portion of the head (occipital prominence), a slightly flattened midface, and/or an abnormally small, pug nose. During the first years of life, as the forearms, lower legs, hands, and feet do not grow proportionally with the rest of the body, short stature (short-limb dwarfism) begins to become apparent. Over time, affected individuals may be unable to fully extend the arms, rotate the arms inward toward the body with the palms facing down, or rotate the arms outward with the palms facing upward. In some cases, affected individuals may also experience progressive degeneration, stiffness, tenderness, and pain of the elbows (osteoarthritis).  Abnormalities of cartilage and bone development may also cause the bones within the fingers, toes, hands, and feet to become increasingly shorter and broader during the first years of life. During the second year of life, the growing ends of these bones may begin to appear abnormally shaped like a cone or a square and may fuse prematurely. This causes the fingers and toes to appear short and stubby. The hands and feet may seem unusually short, broad, and square; and the feet may appear abnormally flat. In early childhood, extra, loose skin may also develop over the fingers. During early childhood, affected individuals may also begin to experience progressive, abnormal curvature of the spine. In rare cases, affected individuals can experience delayed puberty and corneal clouding. The Human Phenotype Ontology provides the following list of signs and symptoms for Acromesomelic dysplasia. If the information is available, the table below includes how often the symptom is seen in people with this condition. You can use the MedlinePlus Medical Dictionary to look up the definitions for these medical terms. Signs and Symptoms Approximate number of patients (when available) Abnormal form of the vertebral bodies 50% Bowing of the long bones 50% Brachydactyly syndrome 50% Depressed nasal bridge 50% Dolichocephaly 50% Frontal bossing 50% Hyperlordosis 50% Joint hypermobility 50% Kyphosis 50% Limitation of joint mobility 50% Micromelia 50% Scoliosis 50% Short stature 50% Sprengel anomaly 50% Acromesomelia - Autosomal recessive inheritance - Beaking of vertebral bodies - Broad finger - Broad metacarpals - Broad metatarsal - Broad phalanx - Cone-shaped epiphyses of the phalanges of the hand - Disproportionate short stature - Flared metaphysis - Hypoplasia of the radius - Joint laxity - Limited elbow extension - Long hallux - Lower thoracic kyphosis - Lumbar hyperlordosis - Ovoid vertebral bodies - Prominent forehead - Radial bowing - Redundant skin on fingers - Short metacarpal - Short metatarsal - Short nail - Short nose - Thoracolumbar interpediculate narrowness - Thoracolumbar kyphosis - The Human Phenotype Ontology (HPO) has collected information on how often a sign or symptom occurs in a condition. Much of this information comes from Orphanet, a European rare disease database. The frequency of a sign or symptom is usually listed as a rough estimate of the percentage of patients who have that feature. The frequency may also be listed as a fraction. The first number of the fraction is how many people had the symptom, and the second number is the total number of people who were examined in one study. For example, a frequency of 25/25 means that in a study of 25 people all patients were found to have that symptom. Because these frequencies are based on a specific study, the fractions may be different if another group of patients are examined. Sometimes, no information on frequency is available. In these cases, the sign or symptom may be rare or common.","Pt presents with Beaking of vertebral bodies, Broad finger, Broad metacarpals, Broad metatarsal, Broad phalanx, Cone-shaped epiphyses of the phalanges of the hand.",3,0.4092441,-0.3442482
2_GARD_QA,0000093.xml,0000093,GARD,https://rarediseases.info.nih.gov/gard/506/acromesomelic-dysplasia-hunter-thompson-type,Acromesomelic dysplasia Hunter Thompson type,1,0000093-1,symptoms,What are the symptoms of Acromesomelic dysplasia Hunter Thompson type ?,"What are the signs and symptoms of Acromesomelic dysplasia Hunter Thompson type? The Human Phenotype Ontology provides the following list of signs and symptoms for Acromesomelic dysplasia Hunter Thompson type. If the information is available, the table below includes how often the symptom is seen in people with this condition. You can use the MedlinePlus Medical Dictionary to look up the definitions for these medical terms. Signs and Symptoms Approximate number of patients (when available) Abnormality of the ankles 90% Brachydactyly syndrome 90% Elbow dislocation 90% Micromelia 90% Neurological speech impairment 90% Short stature 90% Single transverse palmar crease 90% Tarsal synostosis 90% Abnormality of the hip bone 50% Abnormality of the wrist 50% Cognitive impairment 50% Limitation of joint mobility 50% Patellar dislocation 50% Scoliosis 50% Abnormally shaped carpal bones - Acromesomelia - Autosomal recessive inheritance - Cuboidal metacarpal - Distal femoral bowing - Hip dislocation - Hypoplasia of the radius - Hypoplasia of the ulna - Radial bowing - Severe short-limb dwarfism - Short foot - Short thumb - Short tibia - Shortening of all middle phalanges of the fingers - Shortening of all proximal phalanges of the fingers - The Human Phenotype Ontology (HPO) has collected information on how often a sign or symptom occurs in a condition. Much of this information comes from Orphanet, a European rare disease database. The frequency of a sign or symptom is usually listed as a rough estimate of the percentage of patients who have that feature. The frequency may also be listed as a fraction. The first number of the fraction is how many people had the symptom, and the second number is the total number of people who were examined in one study. For example, a frequency of 25/25 means that in a study of 25 people all patients were found to have that symptom. Because these frequencies are based on a specific study, the fractions may be different if another group of patients are examined. Sometimes, no information on frequency is available. In these cases, the sign or symptom may be rare or common.","Pt presents with Acromesomelia, Cuboidal metacarpal, Distal femoral bowing, Hip dislocation, Hypoplasia of the radius, Hypoplasia of the ulna.",3,0.33172908,-0.21516375
2_GARD_QA,0000094.xml,0000094,GARD,https://rarediseases.info.nih.gov/gard/507/acromesomelic-dysplasia-maroteaux-type,Acromesomelic dysplasia Maroteaux type,1,0000094-1,symptoms,What are the symptoms of Acromesomelic dysplasia Maroteaux type ?,"What are the signs and symptoms of Acromesomelic dysplasia Maroteaux type? The Human Phenotype Ontology provides the following list of signs and symptoms for Acromesomelic dysplasia Maroteaux type. If the information is available, the table below includes how often the symptom is seen in people with this condition. You can use the MedlinePlus Medical Dictionary to look up the definitions for these medical terms. Signs and Symptoms Approximate number of patients (when available) Abnormal form of the vertebral bodies 50% Bowing of the long bones 50% Brachydactyly syndrome 50% Depressed nasal bridge 50% Dolichocephaly 50% Frontal bossing 50% Hyperlordosis 50% Joint hypermobility 50% Kyphosis 50% Limitation of joint mobility 50% Micromelia 50% Scoliosis 50% Short stature 50% Sprengel anomaly 50% Acromesomelia - Autosomal recessive inheritance - Beaking of vertebral bodies - Broad finger - Broad metacarpals - Broad metatarsal - Broad phalanx - Cone-shaped epiphyses of the phalanges of the hand - Disproportionate short stature - Flared metaphysis - Hypoplasia of the radius - Joint laxity - Limited elbow extension - Long hallux - Lower thoracic kyphosis - Lumbar hyperlordosis - Ovoid vertebral bodies - Prominent forehead - Radial bowing - Redundant skin on fingers - Short metacarpal - Short metatarsal - Short nail - Short nose - Thoracolumbar interpediculate narrowness - Thoracolumbar kyphosis - The Human Phenotype Ontology (HPO) has collected information on how often a sign or symptom occurs in a condition. Much of this information comes from Orphanet, a European rare disease database. The frequency of a sign or symptom is usually listed as a rough estimate of the percentage of patients who have that feature. The frequency may also be listed as a fraction. The first number of the fraction is how many people had the symptom, and the second number is the total number of people who were examined in one study. For example, a frequency of 25/25 means that in a study of 25 people all patients were found to have that symptom. Because these frequencies are based on a specific study, the fractions may be different if another group of patients are examined. Sometimes, no information on frequency is available. In these cases, the sign or symptom may be rare or common.","Pt presents with Beaking of vertebral bodies, Broad finger, Broad metacarpals, Broad metatarsal, Broad phalanx, Cone-shaped epiphyses of the phalanges of the hand.",3,0.4092441,-0.3442482
2_GARD_QA,0000096.xml,0000096,GARD,https://rarediseases.info.nih.gov/gard/508/acroosteolysis-dominant-type,Acroosteolysis dominant type,1,0000096-1,symptoms,What are the symptoms of Acroosteolysis dominant type ?,"What are the signs and symptoms of Acroosteolysis dominant type? The Human Phenotype Ontology provides the following list of signs and symptoms for Acroosteolysis dominant type. If the information is available, the table below includes how often the symptom is seen in people with this condition. You can use the MedlinePlus Medical Dictionary to look up the definitions for these medical terms. Signs and Symptoms Approximate number of patients (when available) Aplasia/Hypoplasia of the distal phalanges of the toes 90% Brachydactyly syndrome 90% Decreased skull ossification 90% Hypertelorism 90% Long philtrum 90% Osteolysis 90% Periodontitis 90% Reduced bone mineral density 90% Short distal phalanx of finger 90% Short toe 90% Telecanthus 90% Thick eyebrow 90% Wormian bones 90% Abnormal form of the vertebral bodies 50% Abnormality of frontal sinus 50% Abnormality of the fingernails 50% Anteverted nares 50% Arnold-Chiari malformation 50% Arthralgia 50% Bone pain 50% Coarse facial features 50% Dental malocclusion 50% Dolichocephaly 50% Downturned corners of mouth 50% Full cheeks 50% Hearing impairment 50% Joint hypermobility 50% Macrocephaly 50% Narrow mouth 50% Prominent occiput 50% Scoliosis 50% Short neck 50% Thin vermilion border 50% Abnormality of the aortic valve 7.5% Abnormality of the voice 7.5% Bowing of the long bones 7.5% Cataract 7.5% Cleft palate 7.5% Clubbing of toes 7.5% Coarse hair 7.5% Craniofacial hyperostosis 7.5% Displacement of the external urethral meatus 7.5% Dry skin 7.5% Hepatomegaly 7.5% Hydrocephalus 7.5% Hypoplasia of the zygomatic bone 7.5% Intestinal malrotation 7.5% Iris coloboma 7.5% Kyphosis 7.5% Low anterior hairline 7.5% Low-set, posteriorly rotated ears 7.5% Migraine 7.5% Mitral stenosis 7.5% Myopia 7.5% Neurological speech impairment 7.5% Patellar dislocation 7.5% Patent ductus arteriosus 7.5% Pectus carinatum 7.5% Peripheral neuropathy 7.5% Polycystic kidney dysplasia 7.5% Recurrent fractures 7.5% Recurrent respiratory infections 7.5% Skin ulcer 7.5% Splenomegaly 7.5% Synophrys 7.5% Syringomyelia 7.5% Thickened skin 7.5% Umbilical hernia 7.5% Ventricular septal defect 7.5% Wide nasal bridge 7.5% Autosomal dominant inheritance - Juvenile onset - Osteolytic defects of the phalanges of the hand - The Human Phenotype Ontology (HPO) has collected information on how often a sign or symptom occurs in a condition. Much of this information comes from Orphanet, a European rare disease database. The frequency of a sign or symptom is usually listed as a rough estimate of the percentage of patients who have that feature. The frequency may also be listed as a fraction. The first number of the fraction is how many people had the symptom, and the second number is the total number of people who were examined in one study. For example, a frequency of 25/25 means that in a study of 25 people all patients were found to have that symptom. Because these frequencies are based on a specific study, the fractions may be different if another group of patients are examined. Sometimes, no information on frequency is available. In these cases, the sign or symptom may be rare or common.","Pt presents with Juvenile onset, Osteolytic defects of the phalanges of the hand.",3,0.35816157,-0.29980126
